### ISSUE TITLE
Unable to Connect to server but checks pass.

### ISSUE THREAD

**Issue by develroo** [ONLYOFFICE/onlyoffice-nextcloud#496]
So I have Nextcloud running  in a docker stack and the Onlyoffice docker running sharing the same network set up specifically for nextcloud so it can resolve it via a hostname. This works fine and I get the configuration page as shown.

[OnlyOffice Control Panel](https://i.imgur.com/iwKgVu0.png)

However, when I try and create/edit/open any file that it supported (odt, docx,xls etc) I get the following error. 

[Connection Error](https://i.imgur.com/1xfb60p.png)

But when I check on the server for the connection test it is fine

```
docker exec -it --user=www-data nextcloud_app_1 php occ  onlyoffice:documentserver --check
Document server https://oo-community/ version 6.3.1.32 is successfully connected

```

I cannot figure out what it going on as the logs on Onlyoffice container don't show any errors

```
Flushing stats at  Tue Jul 13 2021 09:10:27 GMT+0000 (Coordinated Universal Time)
{ counters:
   { 'statsd.bad_lines_seen': 0,
     'statsd.packets_received': 0,
     'statsd.metrics_received': 0 },
  timers: {},
  gauges: { 'statsd.timestamp_lag': 0 },
  timer_data: {},
  counter_rates:
   { 'statsd.bad_lines_seen': 0,
     'statsd.packets_received': 0,
     'statsd.metrics_received': 0 },
  sets: {},
  pctThreshold: [ 90 ] }
Flushing stats at  Tue Jul 13 2021 09:20:27 GMT+0000 (Coordinated Universal Time)
{ counters:
   { 'statsd.bad_lines_seen': 0,
     'statsd.packets_received': 0,
     'statsd.metrics_received': 0 },
  timers: {},
  gauges: { 'statsd.timestamp_lag': 0 },
  timer_data: {},
  counter_rates:
   { 'statsd.bad_lines_seen': 0,
     'statsd.packets_received': 0,
     'statsd.metrics_received': 0 },
  sets: {},
  pctThreshold: [ 90 ] }
Flushing stats at  Tue Jul 13 2021 09:30:27 GMT+0000 (Coordinated Universal Time)
{ counters:
   { 'statsd.bad_lines_seen': 0,
     'statsd.packets_received': 0,
     'statsd.metrics_received': 0 },
  timers: {},
  gauges: { 'statsd.timestamp_lag': 0 },
  timer_data: {},
  counter_rates:
   { 'statsd.bad_lines_seen': 0,
     'statsd.packets_received': 0,
     'statsd.metrics_received': 0 },
  sets: {},
  pctThreshold: [ 90 ] }
Flushing stats at  Tue Jul 13 2021 09:40:27 GMT+0000 (Coordinated Universal Time)
{ counters:
   { 'statsd.bad_lines_seen': 0,
     'statsd.packets_received': 0,
     'statsd.metrics_received': 0 },
  timers: {},
  gauges: { 'statsd.timestamp_lag': 0 },
  timer_data: {},
  counter_rates:
   { 'statsd.bad_lines_seen': 0,
     'statsd.packets_received': 0,
     'statsd.metrics_received': 0 },
  sets: {},
  pctThreshold: [ 90 ] }
Flushing stats at  Tue Jul 13 2021 09:50:27 GMT+0000 (Coordinated Universal Time)
{ counters:
   { 'statsd.bad_lines_seen': 0,
     'statsd.packets_received': 0,
     'statsd.metrics_received': 0 },
  timers: {},
  gauges: { 'statsd.timestamp_lag': 0 },
  timer_data: {},
  counter_rates:
   { 'statsd.bad_lines_seen': 0,
     'statsd.packets_received': 0,
     'statsd.metrics_received': 0 },
  sets: {},
  pctThreshold: [ 90 ] }
Flushing stats at  Tue Jul 13 2021 10:00:27 GMT+0000 (Coordinated Universal Time)
{ counters:
   { 'statsd.bad_lines_seen': 0,
     'statsd.packets_received': 0,
     'statsd.metrics_received': 0 },
  timers: {},
  gauges: { 'statsd.timestamp_lag': 0 },
  timer_data: {},
  counter_rates:
   { 'statsd.bad_lines_seen': 0,
     'statsd.packets_received': 0,
     'statsd.metrics_received': 0 },
  sets: {},
  pctThreshold: [ 90 ] }
Flushing stats at  Tue Jul 13 2021 10:10:27 GMT+0000 (Coordinated Universal Time)
{ counters:
   { 'statsd.bad_lines_seen': 0,
     'statsd.packets_received': 0,
     'statsd.metrics_received': 0 },
  timers: {},
  gauges: { 'statsd.timestamp_lag': 0 },
  timer_data: {},
  counter_rates:
   { 'statsd.bad_lines_seen': 0,
     'statsd.packets_received': 0,
     'statsd.metrics_received': 0 },
  sets: {},
  pctThreshold: [ 90 ] }

```

And neither does nextcloud ?

Any Ideas?

**Comment by LinneyS** [comment]
Hi @develroo 
Your [Connection Error](https://i.imgur.com/1xfb60p.png) means there is no access from the browser to the file `https://oo-community/web-apps/apps/api/documents/api.js`

Please check it

**Comment by develroo** [comment]
I have. It is accessible via port forwarding to that URL

![oo-debug](https://i.imgur.com/Et3dnyj.png)

**Comment by GeorgeONLYOFFICE** [comment]
Hello @develroo 

Judging by the settings you use in your ONLYOFFICE connector application on Nextcloud side, your Document Server address is to be reached at the following domain `https://oo-community/`. However, when you have previously reached api.js, it was available at this address `https://localhost:9443/web-apps/apps/api/documents/api.js` through localhost, but not the domain name. I would suggest using the ip address instead of localhost here. 

Additionally, please send me a screenshot of what happens when you try to reach the api.js at the following link as it looks like there is an unavailability issue:
`https://oo-community/web-apps/apps/api/documents/api.js`

**Comment by develroo** [comment]
it is not easy to connect directly to is as it is running as a docker container under a VPS. But port forward achieves the same goal and as I showed the check passes so it is definitely visible from the Nextcloud container. The containers are o the same network and so share each others host names. That is just how it works. 

I  tested it using a text based browser from inside the container. Any that works too. 

![onlyofficelinks](https://i.imgur.com/PudakGd.png)

And get exactly the same response accessing that api.js via the local connection.

![url](https://i.imgur.com/zIHeJan.png)

I think that error about not being able to find a place for storage might be relevant, but in that case why does it not show up in the logs ?

I have tried creating a doc with sample content and it does not throw up any errors in the logs, but does not create the doc either.

**Comment by GeorgeONLYOFFICE** [comment]
Hello @develroo

Is there a possibility to install Document Server and Nextcloud  separately on two different machines?
This would make things much easier in terms of configuration for you.

**Comment by develroo** [comment]
Well potentially, but I rather like the idea of spinning it up in a stack. You have to admit it is a bit odd given that I can actually reach the server and  configuration screen on Nextcloud can reach it (otherwise it would not appear) so it has to be communicating somehow. But what is frustrating is the lack of logs on the document server. Is there some sort of debugging I can turn on for it to see it actually rejecting request or something ?

**Comment by GeorgeONLYOFFICE** [comment]
Hello @develroo

In this case, I think the best way of achieving what you need is using docker compose as per this reference
https://github.com/ONLYOFFICE/docker-onlyoffice-nextcloud 
This would allow you to install both Nextcloud and Document Server on the same server and run them in separate docker containers. Let me know if this option works for you.

**Comment by develroo** [comment]
Well I have an existing Nextcloud stack but let me look at the compose file  and make my own with my site details in place. 

Though I am not convinced that is the problem. 

Thanks

**Comment by develroo** [comment]
*sighs*  Same problem using the snippet from the docker-compose file. 
```

version: '3'
services:

   onlyoffice-document-server:
    container_name: oo-server
    image: onlyoffice/documentserver:latest
    restart: always
    expose:
      - '80'
      - '443'
    volumes:
      - document_data:/var/www/onlyoffice/Data
      - document_log:/var/log/onlyoffice
    networks:
      - proxy-tier
      - default


volumes:
  document_data:
  document_log:

networks:
  proxy-tier:

```

You have to add the SSL snippet from the default config

```
cat /etc/nginx/conf.d/ds.conf 
include /etc/nginx/includes/http-common.conf;
server {
  listen 0.0.0.0:80;
  listen [::]:80 default_server;
  server_tokens off;
  
  include /etc/nginx/includes/ds-*.conf;
# SSL configuration
        #
         listen 443 ssl default_server;
         listen [::]:443 ssl default_server;
        #
        # Note: You should disable gzip for SSL traffic.
        # See: https://bugs.debian.org/773332
        #
        # Read up on ssl_ciphers to ensure a secure configuration.
        # See: https://bugs.debian.org/765782
        #
        # Self signed certs generated by the ssl-cert package
        # Don't use them in a production server!
        #
         include snippets/snakeoil.conf;

}

```


 But otherwise it again responds to the check and the config panel works, but same error at the time and again no logging from the server.  There MUST be a way to make the document server more verbose or am I really going to have to set up tcpdump and sniff the communication between the two?

**Comment by develroo** [comment]
OK so to append to the info above. Something very weird is happening. I sniff the traffic between the containers specifically looking for traffic to the server and I get this when I run

```
docker exec -it --user=www-data nextcloud_app_1 php occ  onlyoffice:documentserver --check
Document server https://oo-server.nextcloud_default/ version 6.3.1.32 is successfully connected
```
```
docker run --tty --net=container:nextcloud_app_1  tcpdump tcpdump host oo-server -vv
tcpdump: listening on eth0, link-type EN10MB (Ethernet), capture size 262144 bytes
11:01:29.515832 IP (tos 0x0, ttl 64, id 5293, offset 0, flags [DF], proto TCP (6), length 60)
    07b796aa36ae.42338 > oo-server.nextcloud_default.443: Flags [S], cksum 0x585a (incorrect -> 0x2ce9), seq 4183785099, win 64240, options [mss 1460,sackOK,TS val 671383789 ecr 0,nop,wscale 7], length 0
11:01:29.516135 IP (tos 0x0, ttl 64, id 0, offset 0, flags [DF], proto TCP (6), length 60)
    oo-server.nextcloud_default.443 > 07b796aa36ae.42338: Flags [S.], cksum 0x585a (incorrect -> 0xbfc2), seq 3387567904, ack 4183785100, win 65160, options [mss 1460,sackOK,TS val 2655900196 ecr 671383789,nop,wscale 7], length 0
11:01:29.516185 IP (tos 0x0, ttl 64, id 5294, offset 0, flags [DF], proto TCP (6), length 52)
    07b796aa36ae.42338 > oo-server.nextcloud_default.443: Flags [.], cksum 0x5852 (incorrect -> 0xeb20), seq 1, ack 1, win 502, options [nop,nop,TS val 671383790 ecr 2655900196], length 0
11:01:29.576190 IP (tos 0x0, ttl 64, id 5295, offset 0, flags [DF], proto TCP (6), length 569)
    07b796aa36ae.42338 > oo-server.nextcloud_default.443: Flags [P.], cksum 0x5a57 (incorrect -> 0x6e44), seq 1:518, ack 1, win 502, options [nop,nop,TS val 671383850 ecr 2655900196], length 517
11:01:29.576346 IP (tos 0x0, ttl 64, id 20606, offset 0, flags [DF], proto TCP (6), length 52)
    oo-server.nextcloud_default.443 > 07b796aa36ae.42338: Flags [.], cksum 0x5852 (incorrect -> 0xe89e), seq 1, ack 518, win 506, options [nop,nop,TS val 2655900257 ecr 671383850], length 0
11:01:29.705393 IP (tos 0x0, ttl 64, id 20607, offset 0, flags [DF], proto TCP (6), length 1369)
    oo-server.nextcloud_default.443 > 07b796aa36ae.42338: Flags [P.], cksum 0x5d77 (incorrect -> 0x8332), seq 1:1318, ack 518, win 506, options [nop,nop,TS val 2655900386 ecr 671383850], length 1317
11:01:29.705466 IP (tos 0x0, ttl 64, id 5296, offset 0, flags [DF], proto TCP (6), length 52)
    07b796aa36ae.42338 > oo-server.nextcloud_default.443: Flags [.], cksum 0x5852 (incorrect -> 0xe27c), seq 518, ack 1318, win 501, options [nop,nop,TS val 671383979 ecr 2655900386], length 0
11:01:29.709144 IP (tos 0x0, ttl 64, id 5297, offset 0, flags [DF], proto TCP (6), length 132)
    07b796aa36ae.42338 > oo-server.nextcloud_default.443: Flags [P.], cksum 0x58a2 (incorrect -> 0x2fec), seq 518:598, ack 1318, win 501, options [nop,nop,TS val 671383982 ecr 2655900386], length 80
11:01:29.709278 IP (tos 0x0, ttl 64, id 20608, offset 0, flags [DF], proto TCP (6), length 52)
    oo-server.nextcloud_default.443 > 07b796aa36ae.42338: Flags [.], cksum 0x5852 (incorrect -> 0xe220), seq 1318, ack 598, win 506, options [nop,nop,TS val 2655900390 ecr 671383982], length 0
11:01:29.710334 IP (tos 0x0, ttl 64, id 5298, offset 0, flags [DF], proto TCP (6), length 199)
    07b796aa36ae.42338 > oo-server.nextcloud_default.443: Flags [P.], cksum 0x58e5 (incorrect -> 0x9204), seq 598:745, ack 1318, win 501, options [nop,nop,TS val 671383984 ecr 2655900390], length 147
11:01:29.710443 IP (tos 0x0, ttl 64, id 20609, offset 0, flags [DF], proto TCP (6), length 52)
    oo-server.nextcloud_default.443 > 07b796aa36ae.42338: Flags [.], cksum 0x5852 (incorrect -> 0xe18b), seq 1318, ack 745, win 505, options [nop,nop,TS val 2655900391 ecr 671383984], length 0
11:01:29.712502 IP (tos 0x0, ttl 64, id 20610, offset 0, flags [DF], proto TCP (6), length 355)
    oo-server.nextcloud_default.443 > 07b796aa36ae.42338: Flags [P.], cksum 0x5981 (incorrect -> 0xb117), seq 1318:1621, ack 745, win 505, options [nop,nop,TS val 2655900393 ecr 671383984], length 303
11:01:29.712559 IP (tos 0x0, ttl 64, id 5299, offset 0, flags [DF], proto TCP (6), length 52)
    07b796aa36ae.42338 > oo-server.nextcloud_default.443: Flags [.], cksum 0x5852 (incorrect -> 0xe05c), seq 745, ack 1621, win 501, options [nop,nop,TS val 671383986 ecr 2655900393], length 0
11:01:29.713606 IP (tos 0x0, ttl 64, id 20611, offset 0, flags [DF], proto TCP (6), length 355)
    oo-server.nextcloud_default.443 > 07b796aa36ae.42338: Flags [P.], cksum 0x5981 (incorrect -> 0xf7b0), seq 1621:1924, ack 745, win 505, options [nop,nop,TS val 2655900394 ecr 671383986], length 303
11:01:29.713649 IP (tos 0x0, ttl 64, id 5300, offset 0, flags [DF], proto TCP (6), length 52)
    07b796aa36ae.42338 > oo-server.nextcloud_default.443: Flags [.], cksum 0x5852 (incorrect -> 0xdf2b), seq 745, ack 1924, win 501, options [nop,nop,TS val 671383987 ecr 2655900394], length 0
11:01:29.767702 IP (tos 0x0, ttl 64, id 20612, offset 0, flags [DF], proto TCP (6), length 297)
    oo-server.nextcloud_default.443 > 07b796aa36ae.42338: Flags [P.], cksum 0x5947 (incorrect -> 0xb7d1), seq 1924:2169, ack 745, win 505, options [nop,nop,TS val 2655900448 ecr 671383987], length 245
11:01:29.767772 IP (tos 0x0, ttl 64, id 5301, offset 0, flags [DF], proto TCP (6), length 52)
    07b796aa36ae.42338 > oo-server.nextcloud_default.443: Flags [.], cksum 0x5852 (incorrect -> 0xddca), seq 745, ack 2169, win 501, options [nop,nop,TS val 671384041 ecr 2655900448], length 0
11:01:29.776834 IP (tos 0x0, ttl 64, id 5302, offset 0, flags [DF], proto TCP (6), length 76)
    07b796aa36ae.42338 > oo-server.nextcloud_default.443: Flags [P.], cksum 0x586a (incorrect -> 0x1f6d), seq 745:769, ack 2169, win 501, options [nop,nop,TS val 671384050 ecr 2655900448], length 24
11:01:29.776992 IP (tos 0x0, ttl 64, id 20613, offset 0, flags [DF], proto TCP (6), length 52)
    oo-server.nextcloud_default.443 > 07b796aa36ae.42338: Flags [.], cksum 0x5852 (incorrect -> 0xdd9c), seq 2169, ack 769, win 505, options [nop,nop,TS val 2655900457 ecr 671384050], length 0
11:01:29.780452 IP (tos 0x0, ttl 64, id 20614, offset 0, flags [DF], proto TCP (6), length 52)
    oo-server.nextcloud_default.443 > 07b796aa36ae.42338: Flags [F.], cksum 0x5852 (incorrect -> 0xdd97), seq 2169, ack 769, win 505, options [nop,nop,TS val 2655900461 ecr 671384050], length 0
11:01:29.782056 IP (tos 0x0, ttl 64, id 5303, offset 0, flags [DF], proto TCP (6), length 52)
    07b796aa36ae.42338 > oo-server.nextcloud_default.443: Flags [F.], cksum 0x5852 (incorrect -> 0xdd95), seq 769, ack 2170, win 501, options [nop,nop,TS val 671384055 ecr 2655900461], length 0
11:01:29.782175 IP (tos 0x0, ttl 64, id 20615, offset 0, flags [DF], proto TCP (6), length 52)
    oo-server.nextcloud_default.443 > 07b796aa36ae.42338: Flags [.], cksum 0x5852 (incorrect -> 0xdd8f), seq 2170, ack 770, win 505, options [nop,nop,TS val 2655900463 ecr 671384055], length 0
11:01:29.785981 IP (tos 0x0, ttl 64, id 20214, offset 0, flags [DF], proto TCP (6), length 60)
    07b796aa36ae.42346 > oo-server.nextcloud_default.443: Flags [S], cksum 0x585a (incorrect -> 0x0d57), seq 1901602063, win 64240, options [mss 1460,sackOK,TS val 671384059 ecr 0,nop,wscale 7], length 0
11:01:29.786250 IP (tos 0x0, ttl 64, id 0, offset 0, flags [DF], proto TCP (6), length 60)
    oo-server.nextcloud_default.443 > 07b796aa36ae.42346: Flags [S.], cksum 0x585a (incorrect -> 0x9184), seq 695131449, ack 1901602064, win 65160, options [mss 1460,sackOK,TS val 2655900467 ecr 671384059,nop,wscale 7], length 0
11:01:29.786282 IP (tos 0x0, ttl 64, id 20215, offset 0, flags [DF], proto TCP (6), length 52)
    07b796aa36ae.42346 > oo-server.nextcloud_default.443: Flags [.], cksum 0x5852 (incorrect -> 0xbce2), seq 1, ack 1, win 502, options [nop,nop,TS val 671384060 ecr 2655900467], length 0
11:01:29.812894 IP (tos 0x0, ttl 64, id 20216, offset 0, flags [DF], proto TCP (6), length 569)
    07b796aa36ae.42346 > oo-server.nextcloud_default.443: Flags [P.], cksum 0x5a57 (incorrect -> 0xa0cf), seq 1:518, ack 1, win 502, options [nop,nop,TS val 671384086 ecr 2655900467], length 517
11:01:29.813046 IP (tos 0x0, ttl 64, id 8175, offset 0, flags [DF], proto TCP (6), length 52)
    oo-server.nextcloud_default.443 > 07b796aa36ae.42346: Flags [.], cksum 0x5852 (incorrect -> 0xbaa5), seq 1, ack 518, win 506, options [nop,nop,TS val 2655900493 ecr 671384086], length 0
11:01:29.817332 IP (tos 0x0, ttl 64, id 8176, offset 0, flags [DF], proto TCP (6), length 1369)
    oo-server.nextcloud_default.443 > 07b796aa36ae.42346: Flags [P.], cksum 0x5d77 (incorrect -> 0x6460), seq 1:1318, ack 518, win 506, options [nop,nop,TS val 2655900498 ecr 671384086], length 1317
11:01:29.817383 IP (tos 0x0, ttl 64, id 20217, offset 0, flags [DF], proto TCP (6), length 52)
    07b796aa36ae.42346 > oo-server.nextcloud_default.443: Flags [.], cksum 0x5852 (incorrect -> 0xb57b), seq 518, ack 1318, win 501, options [nop,nop,TS val 671384091 ecr 2655900498], length 0
11:01:29.824138 IP (tos 0x0, ttl 64, id 20218, offset 0, flags [DF], proto TCP (6), length 132)
    07b796aa36ae.42346 > oo-server.nextcloud_default.443: Flags [P.], cksum 0x58a2 (incorrect -> 0x768e), seq 518:598, ack 1318, win 501, options [nop,nop,TS val 671384097 ecr 2655900498], length 80
11:01:29.824245 IP (tos 0x0, ttl 64, id 8177, offset 0, flags [DF], proto TCP (6), length 52)
    oo-server.nextcloud_default.443 > 07b796aa36ae.42346: Flags [.], cksum 0x5852 (incorrect -> 0xb519), seq 1318, ack 598, win 506, options [nop,nop,TS val 2655900505 ecr 671384097], length 0
11:01:29.826520 IP (tos 0x0, ttl 64, id 8178, offset 0, flags [DF], proto TCP (6), length 355)
    oo-server.nextcloud_default.443 > 07b796aa36ae.42346: Flags [P.], cksum 0x5981 (incorrect -> 0xe6db), seq 1318:1621, ack 598, win 506, options [nop,nop,TS val 2655900507 ecr 671384097], length 303
11:01:29.828161 IP (tos 0x0, ttl 64, id 8179, offset 0, flags [DF], proto TCP (6), length 355)
    oo-server.nextcloud_default.443 > 07b796aa36ae.42346: Flags [P.], cksum 0x5981 (incorrect -> 0x28e7), seq 1621:1924, ack 598, win 506, options [nop,nop,TS val 2655900508 ecr 671384097], length 303
11:01:29.828510 IP (tos 0x0, ttl 64, id 20219, offset 0, flags [DF], proto TCP (6), length 52)
    07b796aa36ae.42346 > oo-server.nextcloud_default.443: Flags [.], cksum 0x5852 (incorrect -> 0xb3ea), seq 598, ack 1621, win 499, options [nop,nop,TS val 671384102 ecr 2655900507], length 0
11:01:29.828709 IP (tos 0x0, ttl 64, id 20220, offset 0, flags [DF], proto TCP (6), length 52)
    07b796aa36ae.42346 > oo-server.nextcloud_default.443: Flags [.], cksum 0x5852 (incorrect -> 0xb2bc), seq 598, ack 1924, win 497, options [nop,nop,TS val 671384102 ecr 2655900508], length 0
11:01:29.830877 IP (tos 0x0, ttl 64, id 20221, offset 0, flags [DF], proto TCP (6), length 287)
    07b796aa36ae.42346 > oo-server.nextcloud_default.443: Flags [P.], cksum 0x593d (incorrect -> 0x7527), seq 598:833, ack 1924, win 501, options [nop,nop,TS val 671384104 ecr 2655900508], length 235
11:01:29.830960 IP (tos 0x0, ttl 64, id 8180, offset 0, flags [DF], proto TCP (6), length 52)
    oo-server.nextcloud_default.443 > 07b796aa36ae.42346: Flags [.], cksum 0x5852 (incorrect -> 0xb1c4), seq 1924, ack 833, win 505, options [nop,nop,TS val 2655900511 ecr 671384104], length 0
11:01:29.835958 IP (tos 0x0, ttl 64, id 8181, offset 0, flags [DF], proto TCP (6), length 404)
    oo-server.nextcloud_default.443 > 07b796aa36ae.42346: Flags [P.], cksum 0x59b2 (incorrect -> 0xbfcb), seq 1924:2276, ack 833, win 505, options [nop,nop,TS val 2655900516 ecr 671384104], length 352
11:01:29.836972 IP (tos 0x0, ttl 64, id 20222, offset 0, flags [DF], proto TCP (6), length 52)
    07b796aa36ae.42346 > oo-server.nextcloud_default.443: Flags [.], cksum 0x5852 (incorrect -> 0xb05f), seq 833, ack 2276, win 499, options [nop,nop,TS val 671384110 ecr 2655900516], length 0
11:01:29.839603 IP (tos 0x0, ttl 64, id 20223, offset 0, flags [DF], proto TCP (6), length 76)
    07b796aa36ae.42346 > oo-server.nextcloud_default.443: Flags [P.], cksum 0x586a (incorrect -> 0xed74), seq 833:857, ack 2276, win 501, options [nop,nop,TS val 671384113 ecr 2655900516], length 24
11:01:29.841427 IP (tos 0x0, ttl 64, id 8182, offset 0, flags [DF], proto TCP (6), length 52)
    oo-server.nextcloud_default.443 > 07b796aa36ae.42346: Flags [F.], cksum 0x5852 (incorrect -> 0xb037), seq 2276, ack 857, win 505, options [nop,nop,TS val 2655900522 ecr 671384113], length 0
11:01:29.846009 IP (tos 0x0, ttl 64, id 20224, offset 0, flags [DF], proto TCP (6), length 52)
    07b796aa36ae.42346 > oo-server.nextcloud_default.443: Flags [F.], cksum 0x5852 (incorrect -> 0xb034), seq 857, ack 2277, win 501, options [nop,nop,TS val 671384119 ecr 2655900522], length 0
11:01:29.846144 IP (tos 0x0, ttl 64, id 8183, offset 0, flags [DF], proto TCP (6), length 52)
    oo-server.nextcloud_default.443 > 07b796aa36ae.42346: Flags [.], cksum 0x5852 (incorrect -> 0xb02c), seq 2277, ack 858, win 505, options [nop,nop,TS val 2655900526 ecr 671384119], length 0
11:01:29.851324 IP (tos 0x0, ttl 64, id 7775, offset 0, flags [DF], proto TCP (6), length 60)
    07b796aa36ae.42356 > oo-server.nextcloud_default.443: Flags [S], cksum 0x585a (incorrect -> 0x202b), seq 3119827282, win 64240, options [mss 1460,sackOK,TS val 671384125 ecr 0,nop,wscale 7], length 0
11:01:29.851430 IP (tos 0x0, ttl 64, id 0, offset 0, flags [DF], proto TCP (6), length 60)
    oo-server.nextcloud_default.443 > 07b796aa36ae.42356: Flags [S.], cksum 0x585a (incorrect -> 0x5610), seq 510932539, ack 3119827283, win 65160, options [mss 1460,sackOK,TS val 2655900532 ecr 671384125,nop,wscale 7], length 0
11:01:29.851460 IP (tos 0x0, ttl 64, id 7776, offset 0, flags [DF], proto TCP (6), length 52)
    07b796aa36ae.42356 > oo-server.nextcloud_default.443: Flags [.], cksum 0x5852 (incorrect -> 0x816f), seq 1, ack 1, win 502, options [nop,nop,TS val 671384125 ecr 2655900532], length 0
11:01:29.872906 IP (tos 0x0, ttl 64, id 7777, offset 0, flags [DF], proto TCP (6), length 569)
    07b796aa36ae.42356 > oo-server.nextcloud_default.443: Flags [P.], cksum 0x5a57 (incorrect -> 0xe8dc), seq 1:518, ack 1, win 502, options [nop,nop,TS val 671384146 ecr 2655900532], length 517
11:01:29.873043 IP (tos 0x0, ttl 64, id 59776, offset 0, flags [DF], proto TCP (6), length 52)
    oo-server.nextcloud_default.443 > 07b796aa36ae.42356: Flags [.], cksum 0x5852 (incorrect -> 0x7f3c), seq 1, ack 518, win 506, options [nop,nop,TS val 2655900553 ecr 671384146], length 0
11:01:29.876710 IP (tos 0x0, ttl 64, id 59777, offset 0, flags [DF], proto TCP (6), length 1369)
    oo-server.nextcloud_default.443 > 07b796aa36ae.42356: Flags [P.], cksum 0x5d77 (incorrect -> 0xa821), seq 1:1318, ack 518, win 506, options [nop,nop,TS val 2655900557 ecr 671384146], length 1317
11:01:29.879117 IP (tos 0x0, ttl 64, id 7778, offset 0, flags [DF], proto TCP (6), length 52)
    07b796aa36ae.42356 > oo-server.nextcloud_default.443: Flags [.], cksum 0x5852 (incorrect -> 0x7a1b), seq 518, ack 1318, win 492, options [nop,nop,TS val 671384152 ecr 2655900557], length 0
11:01:29.881831 IP (tos 0x0, ttl 64, id 7779, offset 0, flags [DF], proto TCP (6), length 132)
    07b796aa36ae.42356 > oo-server.nextcloud_default.443: Flags [P.], cksum 0x58a2 (incorrect -> 0x4d61), seq 518:598, ack 1318, win 501, options [nop,nop,TS val 671384155 ecr 2655900557], length 80
11:01:29.881953 IP (tos 0x0, ttl 64, id 59778, offset 0, flags [DF], proto TCP (6), length 52)
    oo-server.nextcloud_default.443 > 07b796aa36ae.42356: Flags [.], cksum 0x5852 (incorrect -> 0x79b5), seq 1318, ack 598, win 506, options [nop,nop,TS val 2655900562 ecr 671384155], length 0
11:01:29.883182 IP (tos 0x0, ttl 64, id 59779, offset 0, flags [DF], proto TCP (6), length 355)
    oo-server.nextcloud_default.443 > 07b796aa36ae.42356: Flags [P.], cksum 0x5981 (incorrect -> 0x982d), seq 1318:1621, ack 598, win 506, options [nop,nop,TS val 2655900564 ecr 671384155], length 303
11:01:29.887094 IP (tos 0x0, ttl 64, id 59780, offset 0, flags [DF], proto TCP (6), length 355)
    oo-server.nextcloud_default.443 > 07b796aa36ae.42356: Flags [P.], cksum 0x5981 (incorrect -> 0x3245), seq 1621:1924, ack 598, win 506, options [nop,nop,TS val 2655900567 ecr 671384155], length 303
11:01:29.888678 IP (tos 0x0, ttl 64, id 7780, offset 0, flags [DF], proto TCP (6), length 52)
    07b796aa36ae.42356 > oo-server.nextcloud_default.443: Flags [.], cksum 0x5852 (incorrect -> 0x7884), seq 598, ack 1621, win 499, options [nop,nop,TS val 671384162 ecr 2655900564], length 0
11:01:29.890029 IP (tos 0x0, ttl 64, id 7781, offset 0, flags [DF], proto TCP (6), length 52)
    07b796aa36ae.42356 > oo-server.nextcloud_default.443: Flags [.], cksum 0x5852 (incorrect -> 0x7753), seq 598, ack 1924, win 497, options [nop,nop,TS val 671384163 ecr 2655900567], length 0
11:01:29.891781 IP (tos 0x0, ttl 64, id 7782, offset 0, flags [DF], proto TCP (6), length 557)
    07b796aa36ae.42356 > oo-server.nextcloud_default.443: Flags [P.], cksum 0x5a4b (incorrect -> 0x1515), seq 598:1103, ack 1924, win 501, options [nop,nop,TS val 671384165 ecr 2655900567], length 505
11:01:29.891878 IP (tos 0x0, ttl 64, id 59781, offset 0, flags [DF], proto TCP (6), length 52)
    oo-server.nextcloud_default.443 > 07b796aa36ae.42356: Flags [.], cksum 0x5852 (incorrect -> 0x754d), seq 1924, ack 1103, win 503, options [nop,nop,TS val 2655900572 ecr 671384165], length 0
11:01:31.974425 IP (tos 0x0, ttl 64, id 59782, offset 0, flags [DF], proto TCP (6), length 624)
    oo-server.nextcloud_default.443 > 07b796aa36ae.42356: Flags [P.], cksum 0x5a8e (incorrect -> 0xfc4c), seq 1924:2496, ack 1103, win 503, options [nop,nop,TS val 2655902655 ecr 671384165], length 572
11:01:31.974490 IP (tos 0x0, ttl 64, id 7783, offset 0, flags [DF], proto TCP (6), length 52)
    07b796aa36ae.42356 > oo-server.nextcloud_default.443: Flags [.], cksum 0x5852 (incorrect -> 0x62cd), seq 1103, ack 2496, win 501, options [nop,nop,TS val 671386248 ecr 2655902655], length 0
11:01:31.977398 IP (tos 0x0, ttl 64, id 7784, offset 0, flags [DF], proto TCP (6), length 76)
    07b796aa36ae.42356 > oo-server.nextcloud_default.443: Flags [P.], cksum 0x586a (incorrect -> 0x18a0), seq 1103:1127, ack 2496, win 501, options [nop,nop,TS val 671386251 ecr 2655902655], length 24
11:01:31.977497 IP (tos 0x0, ttl 64, id 59783, offset 0, flags [DF], proto TCP (6), length 52)
    oo-server.nextcloud_default.443 > 07b796aa36ae.42356: Flags [.], cksum 0x5852 (incorrect -> 0x62ad), seq 2496, ack 1127, win 503, options [nop,nop,TS val 2655902658 ecr 671386251], length 0
11:01:31.980521 IP (tos 0x0, ttl 64, id 59784, offset 0, flags [DF], proto TCP (6), length 52)
    oo-server.nextcloud_default.443 > 07b796aa36ae.42356: Flags [F.], cksum 0x5852 (incorrect -> 0x62a9), seq 2496, ack 1127, win 503, options [nop,nop,TS val 2655902661 ecr 671386251], length 0
11:01:31.984127 IP (tos 0x0, ttl 64, id 7785, offset 0, flags [DF], proto TCP (6), length 52)
    07b796aa36ae.42356 > oo-server.nextcloud_default.443: Flags [F.], cksum 0x5852 (incorrect -> 0x62a4), seq 1127, ack 2497, win 501, options [nop,nop,TS val 671386257 ecr 2655902661], length 0
11:01:31.984246 IP (tos 0x0, ttl 64, id 59785, offset 0, flags [DF], proto TCP (6), length 52)
    oo-server.nextcloud_default.443 > 07b796aa36ae.42356: Flags [.], cksum 0x5852 (incorrect -> 0x629e), seq 2497, ack 1128, win 503, options [nop,nop,TS val 2655902665 ecr 671386257], length 0
11:01:31.988523 IP (tos 0x0, ttl 64, id 16061, offset 0, flags [DF], proto TCP (6), length 60)
    07b796aa36ae.42374 > oo-server.nextcloud_default.443: Flags [S], cksum 0x585a (incorrect -> 0x555f), seq 1610671527, win 64240, options [mss 1460,sackOK,TS val 671386262 ecr 0,nop,wscale 7], length 0
11:01:31.988675 IP (tos 0x0, ttl 64, id 0, offset 0, flags [DF], proto TCP (6), length 60)
    oo-server.nextcloud_default.443 > 07b796aa36ae.42374: Flags [S.], cksum 0x585a (incorrect -> 0x12a3), seq 1147961483, ack 1610671528, win 65160, options [mss 1460,sackOK,TS val 2655902669 ecr 671386262,nop,wscale 7], length 0
11:01:31.988704 IP (tos 0x0, ttl 64, id 16062, offset 0, flags [DF], proto TCP (6), length 52)
    07b796aa36ae.42374 > oo-server.nextcloud_default.443: Flags [.], cksum 0x5852 (incorrect -> 0x3e02), seq 1, ack 1, win 502, options [nop,nop,TS val 671386262 ecr 2655902669], length 0
11:01:32.007754 IP (tos 0x0, ttl 64, id 16063, offset 0, flags [DF], proto TCP (6), length 569)
    07b796aa36ae.42374 > oo-server.nextcloud_default.443: Flags [P.], cksum 0x5a57 (incorrect -> 0xf2c7), seq 1:518, ack 1, win 502, options [nop,nop,TS val 671386281 ecr 2655902669], length 517
11:01:32.007882 IP (tos 0x0, ttl 64, id 63938, offset 0, flags [DF], proto TCP (6), length 52)
    oo-server.nextcloud_default.443 > 07b796aa36ae.42374: Flags [.], cksum 0x5852 (incorrect -> 0x3bd3), seq 1, ack 518, win 506, options [nop,nop,TS val 2655902688 ecr 671386281], length 0
11:01:32.013326 IP (tos 0x0, ttl 64, id 63939, offset 0, flags [DF], proto TCP (6), length 1369)
    oo-server.nextcloud_default.443 > 07b796aa36ae.42374: Flags [P.], cksum 0x5d77 (incorrect -> 0x8662), seq 1:1318, ack 518, win 506, options [nop,nop,TS val 2655902694 ecr 671386281], length 1317
11:01:32.013382 IP (tos 0x0, ttl 64, id 16064, offset 0, flags [DF], proto TCP (6), length 52)
    07b796aa36ae.42374 > oo-server.nextcloud_default.443: Flags [.], cksum 0x5852 (incorrect -> 0x36a7), seq 518, ack 1318, win 501, options [nop,nop,TS val 671386287 ecr 2655902694], length 0
11:01:32.016893 IP (tos 0x0, ttl 64, id 16065, offset 0, flags [DF], proto TCP (6), length 132)
    07b796aa36ae.42374 > oo-server.nextcloud_default.443: Flags [P.], cksum 0x58a2 (incorrect -> 0x3fbb), seq 518:598, ack 1318, win 501, options [nop,nop,TS val 671386290 ecr 2655902694], length 80
11:01:32.016997 IP (tos 0x0, ttl 64, id 63940, offset 0, flags [DF], proto TCP (6), length 52)
    oo-server.nextcloud_default.443 > 07b796aa36ae.42374: Flags [.], cksum 0x5852 (incorrect -> 0x364c), seq 1318, ack 598, win 506, options [nop,nop,TS val 2655902697 ecr 671386290], length 0
11:01:32.020114 IP (tos 0x0, ttl 64, id 63941, offset 0, flags [DF], proto TCP (6), length 355)
    oo-server.nextcloud_default.443 > 07b796aa36ae.42374: Flags [P.], cksum 0x5981 (incorrect -> 0xcaa2), seq 1318:1621, ack 598, win 506, options [nop,nop,TS val 2655902700 ecr 671386290], length 303
11:01:32.021752 IP (tos 0x0, ttl 64, id 63942, offset 0, flags [DF], proto TCP (6), length 355)
    oo-server.nextcloud_default.443 > 07b796aa36ae.42374: Flags [P.], cksum 0x5981 (incorrect -> 0xa94d), seq 1621:1924, ack 598, win 506, options [nop,nop,TS val 2655902702 ecr 671386290], length 303
11:01:32.023014 IP (tos 0x0, ttl 64, id 16066, offset 0, flags [DF], proto TCP (6), length 52)
    07b796aa36ae.42374 > oo-server.nextcloud_default.443: Flags [.], cksum 0x5852 (incorrect -> 0x351b), seq 598, ack 1621, win 499, options [nop,nop,TS val 671386296 ecr 2655902700], length 0
11:01:32.023841 IP (tos 0x0, ttl 64, id 16067, offset 0, flags [DF], proto TCP (6), length 52)
    07b796aa36ae.42374 > oo-server.nextcloud_default.443: Flags [.], cksum 0x5852 (incorrect -> 0x33eb), seq 598, ack 1924, win 497, options [nop,nop,TS val 671386297 ecr 2655902702], length 0
11:01:32.025032 IP (tos 0x0, ttl 64, id 16068, offset 0, flags [DF], proto TCP (6), length 360)
    07b796aa36ae.42374 > oo-server.nextcloud_default.443: Flags [P.], cksum 0x5986 (incorrect -> 0x10da), seq 598:906, ack 1924, win 501, options [nop,nop,TS val 671386298 ecr 2655902702], length 308
11:01:32.025110 IP (tos 0x0, ttl 64, id 63943, offset 0, flags [DF], proto TCP (6), length 52)
    oo-server.nextcloud_default.443 > 07b796aa36ae.42374: Flags [.], cksum 0x5852 (incorrect -> 0x32ac), seq 1924, ack 906, win 504, options [nop,nop,TS val 2655902705 ecr 671386298], length 0
11:01:32.026480 IP (tos 0x0, ttl 64, id 63944, offset 0, flags [DF], proto TCP (6), length 7292)
    oo-server.nextcloud_default.443 > 07b796aa36ae.42374: Flags [P.], cksum 0x749a (incorrect -> 0xd7cb), seq 1924:9164, ack 906, win 504, options [nop,nop,TS val 2655902707 ecr 671386298], length 7240
11:01:32.026538 IP (tos 0x0, ttl 64, id 63949, offset 0, flags [DF], proto TCP (6), length 1100)
    oo-server.nextcloud_default.443 > 07b796aa36ae.42374: Flags [P.], cksum 0x5c6a (incorrect -> 0x4b28), seq 9164:10212, ack 906, win 504, options [nop,nop,TS val 2655902707 ecr 671386298], length 1048
11:01:32.032764 IP (tos 0x0, ttl 64, id 16069, offset 0, flags [DF], proto TCP (6), length 52)
    07b796aa36ae.42374 > oo-server.nextcloud_default.443: Flags [.], cksum 0x5852 (incorrect -> 0x1695), seq 906, ack 9164, win 445, options [nop,nop,TS val 671386306 ecr 2655902707], length 0
11:01:32.032989 IP (tos 0x0, ttl 64, id 16070, offset 0, flags [DF], proto TCP (6), length 52)
    07b796aa36ae.42374 > oo-server.nextcloud_default.443: Flags [.], cksum 0x5852 (incorrect -> 0x1285), seq 906, ack 10212, win 437, options [nop,nop,TS val 671386306 ecr 2655902707], length 0
11:01:32.034106 IP (tos 0x0, ttl 64, id 16071, offset 0, flags [DF], proto TCP (6), length 76)
    07b796aa36ae.42374 > oo-server.nextcloud_default.443: Flags [P.], cksum 0x586a (incorrect -> 0xe5d3), seq 906:930, ack 10212, win 501, options [nop,nop,TS val 671386307 ecr 2655902707], length 24
11:01:32.034506 IP (tos 0x0, ttl 64, id 63950, offset 0, flags [DF], proto TCP (6), length 52)
    oo-server.nextcloud_default.443 > 07b796aa36ae.42374: Flags [F.], cksum 0x5852 (incorrect -> 0x1220), seq 10212, ack 930, win 504, options [nop,nop,TS val 2655902715 ecr 671386307], length 0
11:01:32.038490 IP (tos 0x0, ttl 64, id 16072, offset 0, flags [DF], proto TCP (6), length 52)
    07b796aa36ae.42374 > oo-server.nextcloud_default.443: Flags [F.], cksum 0x5852 (incorrect -> 0x121d), seq 930, ack 10213, win 501, options [nop,nop,TS val 671386312 ecr 2655902715], length 0
11:01:32.038606 IP (tos 0x0, ttl 64, id 63951, offset 0, flags [DF], proto TCP (6), length 52)
    oo-server.nextcloud_default.443 > 07b796aa36ae.42374: Flags [.], cksum 0x5852 (incorrect -> 0x1216), seq 10213, ack 931, win 504, options [nop,nop,TS val 2655902719 ecr 671386312], length 0



```


All seems good right? However, when  I go to open a document/template the same cannot reach server error but **THERE IS NO NETWORK TRAFFIC!**


So I am not concentrating not on the document server itself but the nextcloud app and why it is being inconsistent. I will try add some debugging to it and see if I can't narrow down why is appears to test fine but when it tries to use it it dies silently. 


Feel free to close this issue if you wish and I will file another one with the app once I have narrowed down what is going on.
